{
  "$schema": "https://json-schema.org/draft/2020-12/schema",
  "$id": "capability-index.schema.json",
  "type": "object",
  "required": ["schema_version", "updated", "capabilities"],
  "properties": {
    "schema_version": {"type": "string"},
    "updated": {"type": "string", "format": "date"},
    "spreadsheet": {"type": "string", "format": "uri"},
    "capabilities": {
      "type": "array",
      "minItems": 1,
      "items": {
        "type": "object",
        "required": ["id", "path", "priority"],
        "properties": {
          "id": {"type": "string", "pattern": "^[a-z0-9-]+$"},
          "path": {"type": "string", "pattern": "^[a-z0-9-]+$"},
          "priority": {"enum": ["P0", "P1", "P2"]}
        },
        "additionalProperties": false
      }
    }
  },
  "additionalProperties": true
}
